{
  "name": "Badge",
  "source": "components/ui/Badge.tsx",
  "props": {
    "tone": {
      "values": [
        "neutral",
        "info",
        "success",
        "warning",
        "error"
      ],
      "default": "neutral"
    }
  },
  "states": [
    "default"
  ],
  "notes": "Text always present. Color supports the label, it does not carry it."
}
